,Participant Name,Track,Day,College,State,Feedback
0,Chad Small,AI & ML,3,VIT Vellore,Maharashtra,According majority management clear.
1,Tara Boyd,IoT,2,IIT Madras,Kerala,Rich success per.
2,Bill Lowe,Cybersecurity,1,IIT Madras,Karnataka,Skill their behavior news call city.
3,Aaron Richardson,Blockchain,1,VIT Vellore,Tamil Nadu,Certainly run newspaper marriage weight have.
4,Krystal Cooper,Blockchain,2,CET Trivandrum,Tamil Nadu,Other quite buy research.
5,Jesus Douglas,Cybersecurity,4,IIT Madras,Karnataka,Western present doctor able.
6,Andrew Case,Blockchain,2,NIT Trichy,Karnataka,Energy artist support.
7,Jose Mathis,Blockchain,2,IIT Madras,Kerala,Space born fact fish.
8,Angel Reynolds,AI & ML,2,IIT Madras,Karnataka,Drop pay law offer.
9,Jessica Gonzalez,Cybersecurity,4,NIT Trichy,Kerala,Modern office method move.
10,Caitlin Walters,AI & ML,1,NIT Trichy,Tamil Nadu,Lawyer building drug record.
11,Deborah Cox,IoT,4,IIT Madras,Karnataka,Mother really move have trial feel.
12,James Wall,AI & ML,1,VIT Vellore,Maharashtra,Six out subject all scene.
13,Mary King,AI & ML,4,CET Trivandrum,Karnataka,Government machine machine close threat avoid.
14,Michele Davidson,IoT,1,NIT Trichy,Karnataka,High after wife nice lot mean.
15,David Brown,IoT,1,CET Trivandrum,Kerala,Them white voice.
16,Matthew Gonzales,IoT,4,VIT Vellore,Karnataka,Discussion company economic marriage practice but others.
17,Walter Johnson,AI & ML,2,CET Trivandrum,Maharashtra,Test something experience both whom.
18,Danielle Davis,IoT,1,NIT Trichy,Kerala,Machine draw off PM land throw task.
19,Bonnie Noble,Blockchain,4,VIT Vellore,Tamil Nadu,Gas we paper read name.
20,Erin Gonzalez,IoT,4,IIT Madras,Tamil Nadu,Important local concern likely set time.
21,Cheryl Foster,Cybersecurity,3,NIT Trichy,Kerala,Expect end pull beyond product include.
22,Douglas Pitts,Cybersecurity,2,CET Trivandrum,Tamil Nadu,Ask we near morning religious increase.
23,Paul Ferguson,IoT,2,VIT Vellore,Kerala,Skin season respond summer stay question.
24,Kimberly Diaz,IoT,2,IIT Madras,Tamil Nadu,Bed government strong.
25,Laura Castillo,Blockchain,1,CET Trivandrum,Kerala,South picture model against sing professional.
26,Paige Wright,AI & ML,3,CET Trivandrum,Maharashtra,Result control interest fall.
27,Evelyn Gray,IoT,3,IIT Madras,Kerala,Head society civil single whatever.
28,Samantha Anderson,Blockchain,1,IIT Madras,Karnataka,True computer fear day fly.
29,Kristen Hill MD,AI & ML,1,NIT Trichy,Maharashtra,Partner although market special lead respond.
30,Janet Pearson,AI & ML,2,VIT Vellore,Tamil Nadu,Drop report set it alone during.
31,Lawrence Morse,Cybersecurity,3,VIT Vellore,Karnataka,Control expect finish interview tree.
32,Ms. Lisa Pruitt,Cybersecurity,3,CET Trivandrum,Tamil Nadu,Involve note exactly cold like series present.
33,Christina Garcia,Cybersecurity,2,IIT Madras,Kerala,Human able material sit imagine skin pass.
34,Brian Reilly,IoT,2,CET Trivandrum,Karnataka,Visit eight minute try director indeed.
35,Angela Weber,Blockchain,1,IIT Madras,Kerala,Relate fill situation ability.
36,Kevin Reynolds,AI & ML,1,CET Trivandrum,Maharashtra,Push condition box.
37,Lisa Scott,IoT,2,VIT Vellore,Kerala,Teacher per between free hair finish character.
38,Ellen Silva,AI & ML,4,IIT Madras,Tamil Nadu,Begin and attorney dream treat.
39,Amy Miles,IoT,3,CET Trivandrum,Tamil Nadu,Wide law nor pressure continue.
40,Danielle Ramos,Blockchain,3,CET Trivandrum,Kerala,Hand according husband manager church bed road.
41,Amy Garrison,AI & ML,3,CET Trivandrum,Kerala,Lead find central word health.
42,Gary Green,Cybersecurity,2,CET Trivandrum,Kerala,Reflect race phone ten fill.
43,Jeffrey Noble,Blockchain,1,NIT Trichy,Tamil Nadu,Tax coach management audience model western hold.
44,Marie Henderson,Cybersecurity,1,VIT Vellore,Maharashtra,Tell life raise notice analysis.
45,Katelyn Chan,Blockchain,3,NIT Trichy,Tamil Nadu,Night raise growth include administration play.
46,Calvin White,Cybersecurity,3,IIT Madras,Tamil Nadu,Property view parent parent few even ahead.
47,Kevin Cole,IoT,1,IIT Madras,Karnataka,Country dinner cover clearly.
48,Randall Gonzalez,AI & ML,3,VIT Vellore,Tamil Nadu,Spend audience marriage.
49,Elizabeth Preston,Blockchain,4,CET Trivandrum,Karnataka,Star range arm group mother.
50,Keith Smith,Cybersecurity,2,VIT Vellore,Maharashtra,Expect together model Mr.
51,Jennifer Burns,Blockchain,4,VIT Vellore,Kerala,Recognize rich rise fear floor.
52,Stephanie Garcia,Cybersecurity,1,VIT Vellore,Tamil Nadu,Truth cell benefit last.
53,Alexander Ruiz,Cybersecurity,4,NIT Trichy,Maharashtra,Front weight second could.
54,Calvin Taylor,IoT,4,NIT Trichy,Kerala,Data argue bring agent.
55,Mrs. Jamie Mccormick DVM,IoT,2,CET Trivandrum,Maharashtra,Skin concern me make amount their give.
56,John Williams,IoT,1,VIT Vellore,Karnataka,Raise perhaps set budget.
57,Jessica Garcia,IoT,4,CET Trivandrum,Karnataka,Amount break PM television shoulder begin total law.
58,Ann Swanson,IoT,1,VIT Vellore,Tamil Nadu,Travel change physical street unit level culture.
59,Christina Johnson,Blockchain,2,VIT Vellore,Maharashtra,Meet sport task make.
60,Kimberly Reed,IoT,4,IIT Madras,Kerala,Middle fine pressure live no.
61,Cathy Cochran,IoT,2,IIT Madras,Karnataka,Protect base dinner note year her.
62,Michael Le,Blockchain,3,NIT Trichy,Karnataka,General head blue only.
63,Billy Hernandez,Blockchain,2,IIT Madras,Karnataka,Offer want Mrs step let picture.
64,Harold Marquez,Blockchain,3,NIT Trichy,Kerala,Congress agent finally travel always value professional program.
65,Wendy Bradley,Blockchain,3,IIT Madras,Maharashtra,Mission professor same rule market read.
66,Mary Newton,Blockchain,1,CET Trivandrum,Maharashtra,Yeah responsibility almost.
67,Jeffrey Fitzgerald,AI & ML,3,VIT Vellore,Tamil Nadu,Season open people feeling walk I area.
68,Jennifer Gomez,Cybersecurity,3,IIT Madras,Maharashtra,Adult she important same.
69,Jessica Harris,IoT,3,NIT Trichy,Maharashtra,Part record name else.
70,Megan Savage,AI & ML,2,VIT Vellore,Tamil Nadu,Career under feel yes scene.
71,Richard Werner,AI & ML,3,IIT Madras,Maharashtra,Deep prove artist political.
72,Lisa Tucker,Cybersecurity,4,VIT Vellore,Tamil Nadu,Finish third yet it several above eat.
73,Patricia Cabrera,AI & ML,1,IIT Madras,Maharashtra,Production create nation administration might position career fight.
74,Dr. Samuel Patton,IoT,3,CET Trivandrum,Kerala,Moment fire large property feeling society.
75,Dr. Lauren Klein,AI & ML,3,CET Trivandrum,Kerala,Whole agent newspaper fact sing talk.
76,Richard White,Cybersecurity,1,IIT Madras,Karnataka,Unit talk leader.
77,Mr. Robert Johnson,Cybersecurity,4,IIT Madras,Karnataka,Man protect each oil expect they least.
78,John Martin,IoT,2,VIT Vellore,Maharashtra,Subject cover certainly industry parent fly.
79,Daniel Fisher,IoT,2,IIT Madras,Maharashtra,Need race consider car charge pay west.
80,Kevin Miller,AI & ML,4,NIT Trichy,Kerala,Road lawyer focus until responsibility.
81,Debra Lucas,Cybersecurity,3,IIT Madras,Kerala,Although gun push minute level thought common.
82,Michael Henderson,AI & ML,3,VIT Vellore,Karnataka,Administration fine rock recognize.
83,Diane Rowland,IoT,4,NIT Trichy,Tamil Nadu,Myself east maybe man.
84,Amanda Russo,Cybersecurity,1,NIT Trichy,Karnataka,Century base movement she author page decide.
85,Samuel Mason,Cybersecurity,1,VIT Vellore,Karnataka,Reduce next tend today evening.
86,David Thompson,IoT,2,NIT Trichy,Maharashtra,Hope baby name how check ground.
87,Kimberly Thompson,IoT,2,CET Trivandrum,Karnataka,Strategy item sort trip.
88,John Woods,Cybersecurity,4,NIT Trichy,Karnataka,Understand rock yard benefit professional.
89,Tiffany Moran,Blockchain,1,CET Trivandrum,Kerala,Move race say available hour.
90,Jimmy Best,AI & ML,2,IIT Madras,Maharashtra,Serve right special focus.
91,David Phillips,AI & ML,4,VIT Vellore,Karnataka,Four occur candidate and hope over.
92,Rhonda Cordova,IoT,3,CET Trivandrum,Tamil Nadu,Suffer add audience course.
93,Laura Owens,Cybersecurity,3,VIT Vellore,Kerala,Actually anyone leave view deal notice wonder.
94,Cynthia Adams,Cybersecurity,2,NIT Trichy,Maharashtra,Yet behavior health recognize.
95,Julia Torres,IoT,1,VIT Vellore,Karnataka,Stock goal south stock compare generation next.
96,Brian Ritter,IoT,2,CET Trivandrum,Kerala,State your dog black water.
97,Rachael Anderson PhD,AI & ML,1,CET Trivandrum,Maharashtra,City wife remember then.
98,John Kelly,Cybersecurity,1,NIT Trichy,Tamil Nadu,White single machine their.
99,Natalie Tran,Cybersecurity,3,IIT Madras,Karnataka,Live strong major room senior look letter once.
100,Beverly Chan,Blockchain,1,VIT Vellore,Karnataka,Music war moment window somebody determine maybe none.
101,Mark Osborn,Blockchain,1,CET Trivandrum,Karnataka,Reveal foreign part success really water very knowledge.
102,Vanessa Dunn,IoT,1,VIT Vellore,Karnataka,Condition him actually prevent establish outside.
103,Cindy Parker,Cybersecurity,2,NIT Trichy,Kerala,Huge poor against issue style kind.
104,James Curry,Cybersecurity,2,VIT Vellore,Karnataka,Teach well part reality.
105,Angela Le,AI & ML,1,CET Trivandrum,Tamil Nadu,Ground work walk garden seem.
106,Tammie Oliver,IoT,3,IIT Madras,Tamil Nadu,Military structure third field fight customer.
107,Angel Reese,Cybersecurity,1,IIT Madras,Kerala,Family protect material true miss.
108,Pamela Miller,Blockchain,2,CET Trivandrum,Tamil Nadu,Give forget later model.
109,Debra Barnes,IoT,1,VIT Vellore,Tamil Nadu,Single where clearly even source day deep man.
110,Courtney Carrillo,AI & ML,1,VIT Vellore,Kerala,Health country none citizen year whose.
111,Valerie Bell,Cybersecurity,3,IIT Madras,Karnataka,Father expert sell.
112,Kevin Fowler,IoT,1,VIT Vellore,Tamil Nadu,Watch actually choose talk bank present president.
113,Scott Ellis,IoT,1,NIT Trichy,Karnataka,Recently main more fight major listen.
114,Patricia Pierce,Blockchain,3,VIT Vellore,Maharashtra,Sound happy half behind per sit issue.
115,Alex Nolan,Blockchain,3,IIT Madras,Kerala,Course win join let those.
116,John Martin,IoT,1,NIT Trichy,Maharashtra,Our movie our notice kitchen.
117,Carrie Smith,Blockchain,4,CET Trivandrum,Maharashtra,Democratic ever practice media way able.
118,Henry Campbell,AI & ML,4,VIT Vellore,Karnataka,Commercial right cultural fill address each show.
119,Christine Miller,Cybersecurity,2,NIT Trichy,Tamil Nadu,Skill maintain structure upon everybody husband discuss.
120,Nicholas Weaver,IoT,4,NIT Trichy,Karnataka,Pay keep one always else professor no.
121,Lauren Finley,Cybersecurity,2,NIT Trichy,Karnataka,Available step board quickly stock.
122,Sean Jackson,IoT,4,IIT Madras,Karnataka,Prevent he media provide how.
123,Justin Morrison,Cybersecurity,4,IIT Madras,Tamil Nadu,Seem require subject executive able reason support.
124,Kimberly Marquez,Blockchain,1,NIT Trichy,Tamil Nadu,Nation guess join degree clearly.
125,David Wright,AI & ML,4,NIT Trichy,Kerala,Focus president indicate behind might perhaps ok.
126,Stephanie Jones,AI & ML,3,NIT Trichy,Tamil Nadu,Scene environmental law involve cell.
127,Melissa Berry,Cybersecurity,2,IIT Madras,Tamil Nadu,A way knowledge small student month fine believe.
128,Kelly Chan,IoT,2,NIT Trichy,Maharashtra,Would happen reflect art.
129,Andrew Phillips,IoT,2,NIT Trichy,Maharashtra,After what money international where difficult.
130,Sydney Mckinney,Blockchain,4,CET Trivandrum,Maharashtra,Loss ok arrive understand police against however.
131,Heather Young,AI & ML,4,CET Trivandrum,Maharashtra,Their computer million everything take their if condition.
132,Mrs. Angela Gutierrez MD,IoT,2,CET Trivandrum,Tamil Nadu,Case not once sit look morning.
133,Charles Ali,Cybersecurity,2,CET Trivandrum,Kerala,Action suggest clearly trip number list its.
134,Heather Potter,IoT,3,NIT Trichy,Tamil Nadu,Air day enter.
135,Sean Russell,Cybersecurity,4,IIT Madras,Kerala,Art my father site color west.
136,Joel Donaldson,Blockchain,3,NIT Trichy,Kerala,Whose sure local yard.
137,Douglas Alexander,AI & ML,3,IIT Madras,Kerala,Gun near deal Democrat place statement one responsibility.
138,David Marshall,Blockchain,3,CET Trivandrum,Tamil Nadu,Cold range mention hard.
139,Sandra Lindsey,AI & ML,3,VIT Vellore,Kerala,Behavior indicate forget actually deal claim before information.
140,Brian Weaver,IoT,1,VIT Vellore,Maharashtra,Kid him peace firm drug major audience.
141,Scott Lane,AI & ML,4,IIT Madras,Karnataka,Necessary their bring.
142,Chad Summers,Cybersecurity,3,CET Trivandrum,Kerala,Two sometimes near meet firm.
143,Mrs. Holly Pierce,Cybersecurity,3,IIT Madras,Tamil Nadu,Choose charge key drop rather order.
144,Daniel Ball,AI & ML,4,NIT Trichy,Karnataka,End form event institution say scientist she grow.
145,Donna Blackburn,Cybersecurity,2,IIT Madras,Maharashtra,Arm former be image full.
146,Ian Cole,IoT,3,IIT Madras,Kerala,Analysis fire art society.
147,Lauren Mckinney,Cybersecurity,1,IIT Madras,Karnataka,Final one talk wait dinner information data occur.
148,Jeffrey Gonzalez,Blockchain,2,NIT Trichy,Karnataka,Check machine pressure wind put space.
149,Julia Ruiz,AI & ML,4,CET Trivandrum,Tamil Nadu,Office level age see home especially doctor.
150,Todd Massey,Cybersecurity,4,IIT Madras,Karnataka,Significant religious money.
151,Kent Yang,IoT,4,NIT Trichy,Kerala,Already myself garden room write.
152,Todd Garrett,AI & ML,4,NIT Trichy,Tamil Nadu,Push box really customer between whatever near.
153,William Cain,IoT,3,IIT Madras,Maharashtra,Want site me south director at before.
154,Jill Mercado,Blockchain,3,IIT Madras,Kerala,Speak information pretty view community mention.
155,Joshua Pope,Blockchain,2,NIT Trichy,Maharashtra,Buy now whatever.
156,Molly Bishop,AI & ML,3,IIT Madras,Maharashtra,Today far education.
157,Cynthia Mckenzie,Blockchain,3,CET Trivandrum,Tamil Nadu,Sense rule particularly article.
158,Patrick Small,Cybersecurity,1,IIT Madras,Tamil Nadu,Long air same key.
159,Adriana Burns,Blockchain,4,VIT Vellore,Maharashtra,Mission house office area role bar.
160,Paula Peterson,AI & ML,2,NIT Trichy,Maharashtra,Later industry seek challenge magazine.
161,Cheryl Peterson,AI & ML,3,NIT Trichy,Maharashtra,Soldier analysis cover live despite skin sister.
162,Randy Roberts,Cybersecurity,2,CET Trivandrum,Kerala,Practice note ever away charge human form.
163,Ebony Pearson,Cybersecurity,1,NIT Trichy,Karnataka,Anything design section interview.
164,Melinda Vazquez,AI & ML,3,CET Trivandrum,Maharashtra,Tough manager enough low whom since cover.
165,Robert Payne,Cybersecurity,3,VIT Vellore,Tamil Nadu,Appear use hit even.
166,Steven Brown,Cybersecurity,1,IIT Madras,Karnataka,Then open themselves rich tough example.
167,Noah Walker,IoT,3,IIT Madras,Tamil Nadu,Hard Mr energy truth.
168,Jonathan Mckay,IoT,3,VIT Vellore,Maharashtra,Throughout party strong write only improve project debate.
169,Melanie Dudley,Blockchain,3,CET Trivandrum,Maharashtra,Pattern color open catch.
170,Joanna Bishop,Cybersecurity,3,CET Trivandrum,Tamil Nadu,Nation build although central election help.
171,Nathan Thompson,IoT,4,CET Trivandrum,Tamil Nadu,Enjoy question foot thank.
172,Anita Townsend,IoT,3,CET Trivandrum,Maharashtra,Focus drug get energy goal.
173,Jamie Thompson,AI & ML,1,IIT Madras,Maharashtra,Business camera his apply leg go able follow.
174,Daniel Reed,AI & ML,3,VIT Vellore,Tamil Nadu,Amount sense early more.
175,Shawn Lopez,Blockchain,3,VIT Vellore,Karnataka,Think light have trade interest.
176,Christina Hall,AI & ML,4,CET Trivandrum,Tamil Nadu,Camera arrive listen suddenly after successful power.
177,Dwayne Robles,IoT,4,VIT Vellore,Kerala,Vote spring meet word claim culture.
178,Stacie Webb,AI & ML,4,CET Trivandrum,Karnataka,Light she own small.
179,Brenda Young,IoT,2,NIT Trichy,Karnataka,Feeling later father go whatever forward inside.
180,Patrick Hardin,AI & ML,1,CET Trivandrum,Tamil Nadu,Establish concern local easy paper.
181,Sydney Gonzalez,Blockchain,2,VIT Vellore,Maharashtra,Task space game have technology sign dinner news.
182,Tyler Johnson,AI & ML,4,NIT Trichy,Karnataka,Class room simply walk service smile.
183,Matthew Cardenas,AI & ML,4,NIT Trichy,Kerala,Candidate help school him yourself.
184,Jessica Smith,Blockchain,1,VIT Vellore,Maharashtra,Mission ball child second high impact include.
185,Samantha King,AI & ML,3,IIT Madras,Tamil Nadu,Thus field cold traditional trial more too.
186,Geoffrey Lewis,Blockchain,4,CET Trivandrum,Maharashtra,Debate some citizen policy simply participant onto movie.
187,Kyle Miller,IoT,2,IIT Madras,Kerala,Class page action detail necessary.
188,Michael Le,AI & ML,4,IIT Madras,Maharashtra,Color never article summer in water suddenly.
189,Katie Chung,IoT,2,VIT Vellore,Tamil Nadu,Weight enter adult letter buy.
190,Jeffrey Parsons,Cybersecurity,3,VIT Vellore,Tamil Nadu,Effect away area because whole.
191,Charles Harris,Blockchain,3,IIT Madras,Kerala,Rise matter culture must age list.
192,Sharon Perez,Blockchain,1,NIT Trichy,Kerala,Involve performance wife activity ability.
193,Kristina Cummings,IoT,3,CET Trivandrum,Kerala,Answer information unit long no.
194,Ryan Green,IoT,2,IIT Madras,Karnataka,Word door spend for environment.
195,Stephanie Coleman,AI & ML,3,CET Trivandrum,Kerala,Ready hit study increase also teacher ok.
196,Ashley Baker,Cybersecurity,4,CET Trivandrum,Karnataka,Who worry not leg.
197,Erik Miller,IoT,2,IIT Madras,Karnataka,Follow national crime its.
198,Donna Grimes,IoT,2,NIT Trichy,Kerala,Really really discussion war control.
199,Bradley Taylor,Cybersecurity,1,IIT Madras,Tamil Nadu,Carry under modern nation reason miss this.
200,Danielle Lawrence,IoT,2,IIT Madras,Maharashtra,Training defense risk whole effort recognize.
201,Morgan Simmons,IoT,4,CET Trivandrum,Kerala,Interest institution right north less use window.
202,Charles Mann,Blockchain,3,NIT Trichy,Maharashtra,Treat address authority alone wind writer.
203,Robert Boyer,IoT,2,IIT Madras,Kerala,Believe late decide leg radio lawyer.
204,Marc Mckee,Cybersecurity,4,VIT Vellore,Karnataka,Woman more until board.
205,Beth Brown,IoT,3,VIT Vellore,Tamil Nadu,Money test positive word simple.
206,Jon Chambers,IoT,2,IIT Madras,Tamil Nadu,Fight against tough kid brother pick at.
207,Kristy Jones,IoT,4,IIT Madras,Kerala,Sell realize without girl part catch.
208,Matthew Santos,AI & ML,4,VIT Vellore,Tamil Nadu,Name use eight require avoid dinner.
209,Laura Hurst,Cybersecurity,1,VIT Vellore,Karnataka,Response activity black less.
210,David Morris,Blockchain,2,CET Trivandrum,Maharashtra,My decide because call.
211,Denise Green,IoT,1,CET Trivandrum,Karnataka,Operation because single week.
212,Kenneth Valentine,Cybersecurity,3,VIT Vellore,Tamil Nadu,Practice move test none meet trade.
213,Linda Underwood,Blockchain,3,IIT Madras,Maharashtra,Top argue very during compare remain institution family.
214,Mary Smith,Cybersecurity,1,CET Trivandrum,Kerala,Career generation Mrs Mrs.
215,Shelby Glenn,Blockchain,4,VIT Vellore,Kerala,Here peace wife into fight us.
216,Zachary Mcmahon,Cybersecurity,2,IIT Madras,Kerala,Group imagine stay member store.
217,Amanda Davis MD,Cybersecurity,3,VIT Vellore,Tamil Nadu,Focus business however its account street have.
218,Ross Lowery,AI & ML,1,IIT Madras,Tamil Nadu,Response white tax environmental in particular.
219,Crystal Kennedy DVM,Blockchain,2,IIT Madras,Maharashtra,Artist standard shake also administration picture.
220,Sara Watson,IoT,1,IIT Madras,Kerala,Decade foot statement if family often nothing.
221,Aaron Thomas,Cybersecurity,1,NIT Trichy,Karnataka,Skin check factor learn or discuss.
222,Dalton Rocha,AI & ML,3,NIT Trichy,Karnataka,Gun character include thousand exist believe.
223,Robert Miller,IoT,1,IIT Madras,Maharashtra,Perhaps teach particular mission tax teacher.
224,Lisa Dickson,AI & ML,1,CET Trivandrum,Kerala,Room daughter assume day prepare food store.
225,Victoria Mcdonald,Blockchain,2,IIT Madras,Karnataka,Send which particularly account still in begin.
226,James Jones,AI & ML,2,VIT Vellore,Karnataka,Structure image bring same whatever against.
227,Michael Vazquez,IoT,3,IIT Madras,Tamil Nadu,Sea national agent return.
228,Mark Barnes,AI & ML,1,NIT Trichy,Tamil Nadu,Deal drive beat.
229,Shelby Little,Cybersecurity,2,CET Trivandrum,Kerala,Table fund involve chance.
230,Seth Knight,Blockchain,1,CET Trivandrum,Tamil Nadu,Job put town coach already hold.
231,Crystal Lewis,AI & ML,3,VIT Vellore,Kerala,Certainly small majority or need.
232,Tyler Clay,Blockchain,2,VIT Vellore,Karnataka,Pay professor go firm hot you cold house.
233,Anne Miller,AI & ML,2,CET Trivandrum,Maharashtra,Newspaper contain change the clear suffer.
234,Holly Wright,AI & ML,3,NIT Trichy,Kerala,Beat tend team room will star great.
235,Jonathan Mack,AI & ML,3,IIT Madras,Maharashtra,Attack than do person.
236,James Mckay,Cybersecurity,4,IIT Madras,Kerala,Worry case answer.
237,Amanda Schneider,IoT,3,CET Trivandrum,Kerala,Talk we personal learn social seven per treat.
238,Charles Stephens,Blockchain,3,IIT Madras,Tamil Nadu,Husband relationship quality herself major.
239,Bryan Schmidt,Cybersecurity,4,NIT Trichy,Karnataka,Brother chair fish.
240,Steven Hubbard,Cybersecurity,2,NIT Trichy,Tamil Nadu,Likely staff leave manage concern certainly around cold.
241,Eric Riddle,IoT,2,NIT Trichy,Maharashtra,Such Democrat piece.
242,Patricia Lewis,Blockchain,3,CET Trivandrum,Tamil Nadu,Attention school forward across enough PM base.
243,Xavier Miles,Blockchain,3,NIT Trichy,Maharashtra,Arrive husband no course information.
244,Richard Roberts,Blockchain,1,NIT Trichy,Tamil Nadu,To cause behavior a decade church.
245,Cesar Martinez Jr.,Blockchain,4,CET Trivandrum,Tamil Nadu,Bag language media.
246,Ernest Horton,Cybersecurity,3,VIT Vellore,Maharashtra,Nothing writer phone identify option professional no.
247,Nicole Stone,IoT,2,VIT Vellore,Maharashtra,New today leave talk apply leave public there.
248,Keith Hensley,Cybersecurity,3,VIT Vellore,Maharashtra,Talk give agreement media analysis thank whom.
249,Christina Novak,Blockchain,2,NIT Trichy,Kerala,Wait along however blue easy.
250,Zachary Smith,Blockchain,4,IIT Madras,Karnataka,Unit individual ten religious bar test item.
251,Dana Lane,AI & ML,4,IIT Madras,Maharashtra,Man public talk create.
252,Amy Rogers,AI & ML,2,NIT Trichy,Kerala,Ok house public present live option fear.
253,James Wagner,AI & ML,2,CET Trivandrum,Karnataka,Administration keep across right together effect final staff.
254,Brandon Dodson,Blockchain,1,IIT Madras,Karnataka,Run policy attorney myself action provide us.
255,Joseph Wade MD,Cybersecurity,4,NIT Trichy,Karnataka,Ten yard upon direction early our.
256,Nancy Brown,AI & ML,2,VIT Vellore,Maharashtra,Along try store positive church available.
257,Deanna Hubbard,AI & ML,2,VIT Vellore,Kerala,Hair agreement assume officer.
258,Joshua Bond,IoT,2,IIT Madras,Kerala,End fill check different red they certain.
259,Andrea Smith,Cybersecurity,3,VIT Vellore,Tamil Nadu,In attorney kind what hope recently federal meet.
260,Deborah Bradley,Cybersecurity,1,IIT Madras,Maharashtra,Front develop energy success else.
261,Wesley Moyer,Cybersecurity,3,IIT Madras,Kerala,State move single finish hair system central.
262,James Martin,Cybersecurity,3,IIT Madras,Karnataka,Head through receive environment.
263,Christy Harris,Blockchain,3,NIT Trichy,Karnataka,Need fly statement save.
264,Elizabeth Austin,Blockchain,1,CET Trivandrum,Maharashtra,Evidence company defense present soon.
265,Ashley Cantu,Cybersecurity,2,NIT Trichy,Maharashtra,Blood become probably expert stay matter director final.
266,Henry Young,AI & ML,4,IIT Madras,Maharashtra,Again commercial report leader.
267,Walter Alexander,Blockchain,3,NIT Trichy,Kerala,Away treatment time this government.
268,Sharon Herrera,Blockchain,1,IIT Madras,Kerala,Education person personal third question range sort.
269,Matthew Williams,AI & ML,4,VIT Vellore,Tamil Nadu,Her sit magazine response.
270,Alicia Carter,Cybersecurity,2,NIT Trichy,Kerala,For address real employee book sound own.
271,Christina Hernandez MD,AI & ML,4,NIT Trichy,Kerala,Arm dinner without our art some dinner.
272,Kurt Fisher,Blockchain,2,IIT Madras,Maharashtra,Clear care service line network hospital view.
273,Anthony Price,IoT,3,VIT Vellore,Maharashtra,Country policy must source add debate join.
274,Jerry Cooper,IoT,4,VIT Vellore,Maharashtra,Worker care perform sea.
275,Bianca Gutierrez,IoT,2,CET Trivandrum,Tamil Nadu,Follow mother forward ago save painting.
276,Nicholas Newman,Blockchain,2,NIT Trichy,Tamil Nadu,Artist special long structure note.
277,Annette Rodriguez,IoT,1,CET Trivandrum,Maharashtra,Above play experience who skin create energy explain.
278,Nathan Kelley,IoT,4,VIT Vellore,Maharashtra,Sometimes whether event other.
279,John James,Cybersecurity,1,NIT Trichy,Maharashtra,Herself despite beat this old network.
280,Jeff King,IoT,1,IIT Madras,Maharashtra,Usually newspaper movie customer media never.
281,Faith Morris,Cybersecurity,3,IIT Madras,Karnataka,Address clearly PM lot land finish.
282,Susan Jackson,Cybersecurity,4,NIT Trichy,Kerala,Result similar modern under born human explain.
283,Mrs. Laura Mitchell DDS,AI & ML,4,CET Trivandrum,Maharashtra,Behavior activity high campaign either case entire.
284,Michael Marquez,AI & ML,4,CET Trivandrum,Kerala,Certainly wide west source.
285,Dylan Mcgrath,AI & ML,4,CET Trivandrum,Maharashtra,Usually like theory.
286,Catherine Robinson,Cybersecurity,1,NIT Trichy,Kerala,Sister hand production artist government century protect.
287,John Taylor,AI & ML,1,CET Trivandrum,Karnataka,Seek century girl bill thank court candidate.
288,Micheal Prince,Blockchain,1,VIT Vellore,Tamil Nadu,Pick issue live born.
289,John Henderson,AI & ML,2,CET Trivandrum,Maharashtra,Voice visit fire base lead window popular bar.
290,David Kidd,Cybersecurity,1,CET Trivandrum,Kerala,North summer base degree just.
291,Kathryn Cooper,Cybersecurity,1,CET Trivandrum,Tamil Nadu,Economy yeah just weight wish town then.
292,Stephanie Ramirez,AI & ML,2,IIT Madras,Karnataka,Ball fact blue themselves.
