,Participant Name,Track,Day,College,State,Feedback
293,Michael Butler,AI & ML,2,CET Trivandrum,Tamil Nadu,Agreement establish responsibility board into protect think government.
294,Dr. Donald Thomas,AI & ML,4,VIT Vellore,Karnataka,Contain position street design note evening century heavy.
295,Maxwell Gardner,IoT,3,VIT Vellore,Maharashtra,Foot movie team top scientist expert.
296,Ryan Garcia,Blockchain,1,NIT Trichy,Karnataka,World citizen must concern father national.
297,Shane Dorsey,Blockchain,2,NIT Trichy,Kerala,Pick it other should miss doctor summer.
298,Luis Morales,IoT,2,CET Trivandrum,Kerala,Better doctor official along business water.
299,Julie Evans,IoT,1,CET Trivandrum,Kerala,Sit yet chance according.
300,Michael Chase,Cybersecurity,4,VIT Vellore,Karnataka,Operation establish with necessary yes hotel.
301,Gail Raymond,Blockchain,1,IIT Madras,Kerala,All myself control today child special five.
302,Kari Sparks,Cybersecurity,2,VIT Vellore,Maharashtra,Project guy want.
303,Isaac Velazquez,Blockchain,2,CET Trivandrum,Maharashtra,Heart law unit fact argue.
304,Robert Hunter,Cybersecurity,4,IIT Madras,Maharashtra,Seek leader recognize church.
305,Teresa Mason,AI & ML,2,NIT Trichy,Karnataka,Think throughout positive north institution market exist.
306,Zachary Robinson,AI & ML,1,VIT Vellore,Tamil Nadu,Upon mind us spend financial throw tell some.
307,Leroy Pollard,Cybersecurity,1,VIT Vellore,Karnataka,Clear wonder difference Republican.
308,Kimberly Mitchell,AI & ML,2,CET Trivandrum,Tamil Nadu,Car teach wife population another member.
309,Amanda Vargas,Cybersecurity,1,IIT Madras,Maharashtra,Instead value hair window very life billion.
310,Nicholas Randall,Cybersecurity,1,VIT Vellore,Tamil Nadu,Material point clearly begin.
311,Bryan Murphy,AI & ML,4,NIT Trichy,Karnataka,Nation leg simple citizen.
312,Lauren Montgomery,Cybersecurity,3,IIT Madras,Karnataka,Stock lawyer just stop wonder report dog.
313,Diane Dean,Cybersecurity,4,NIT Trichy,Karnataka,Trouble order child whether fight include so expert.
314,Timothy Reyes,Blockchain,2,IIT Madras,Karnataka,Card knowledge case really exist form trip industry.
315,Amy Parrish,Cybersecurity,2,IIT Madras,Kerala,Travel hair memory box my market.
316,Rachel Webster,IoT,2,CET Trivandrum,Kerala,Report war popular have.
317,Jeffrey Harrell,AI & ML,1,IIT Madras,Maharashtra,Local control media.
318,Clarence Park,Blockchain,3,VIT Vellore,Kerala,Marriage on remember heavy until become since pick.
319,John Allen,AI & ML,1,IIT Madras,Karnataka,Standard owner make policy true rather water.
320,Tina Brown,IoT,3,VIT Vellore,Maharashtra,Rock item particularly feel concern successful page.
321,Jacob Goodman,IoT,2,CET Trivandrum,Karnataka,Will test study unit back how.
322,Amy Oliver,Cybersecurity,3,CET Trivandrum,Maharashtra,Huge community voice year including course serve.
323,Andrew Lee,Cybersecurity,3,NIT Trichy,Kerala,Fill third interest wait.
324,Lauren Ponce,Cybersecurity,2,CET Trivandrum,Karnataka,Person product anything how.
325,Joseph Carlson,Blockchain,3,NIT Trichy,Kerala,Wall catch enjoy economy opportunity eye.
326,Jamie Williams,IoT,1,VIT Vellore,Karnataka,Rather evening beyond nation.
327,Robert Holt,AI & ML,3,CET Trivandrum,Tamil Nadu,Its able whole eight.
328,Amy Calderon,Cybersecurity,2,CET Trivandrum,Kerala,Take friend character yet themselves suffer against.
329,Bryan Rich,IoT,2,CET Trivandrum,Kerala,Young art child discuss small never.
330,Jennifer Bowers,Blockchain,1,NIT Trichy,Kerala,Him owner newspaper air.
331,Mary Madden,Cybersecurity,3,NIT Trichy,Tamil Nadu,Democratic wrong attention.
332,Molly Wang,IoT,3,VIT Vellore,Kerala,Create role yard third even oil positive.
333,Christopher Cruz,Cybersecurity,2,CET Trivandrum,Tamil Nadu,Effort director yeah player middle different beautiful shoulder.
334,Ryan Holden,Cybersecurity,4,IIT Madras,Kerala,Fast effect if chance same minute special cup.
335,Steven Miller,Blockchain,1,VIT Vellore,Tamil Nadu,On morning rate institution huge likely.
336,Philip Moore,AI & ML,4,IIT Madras,Maharashtra,Small after carry financial data.
337,Krista Allen,Cybersecurity,4,CET Trivandrum,Kerala,Listen unit common watch while follow say.
338,Jessica Morse,IoT,3,CET Trivandrum,Maharashtra,Interesting go card before perform strategy general.
339,Scott Ray,Cybersecurity,1,CET Trivandrum,Karnataka,Kid and reflect fear hand.
340,Cindy Pena,Cybersecurity,4,VIT Vellore,Karnataka,Trial boy citizen statement.
341,Jonathan Barajas,Blockchain,1,IIT Madras,Kerala,News water power do build claim.
342,Megan Herrera,AI & ML,1,CET Trivandrum,Karnataka,With force season pay exist letter what.
343,Autumn Munoz,Blockchain,2,NIT Trichy,Karnataka,Sometimes address official possible.
344,Mrs. Christina Barrett,AI & ML,2,NIT Trichy,Maharashtra,Goal necessary president common.
345,Erica Smith,Blockchain,3,NIT Trichy,Maharashtra,Again change type economic.
346,Robert Garcia,AI & ML,4,IIT Madras,Maharashtra,Owner why notice once product talk card.
347,Christopher Haynes,IoT,1,IIT Madras,Karnataka,Green call first environmental.
348,Mr. Jason Hernandez,Cybersecurity,4,VIT Vellore,Maharashtra,Including national month them clear.
349,David Daniels,Cybersecurity,1,NIT Trichy,Karnataka,Agreement contain let also none card cause benefit.
350,Kelly Davis,IoT,4,NIT Trichy,Maharashtra,Answer week season accept thousand.
351,Ellen Hughes,Blockchain,3,VIT Vellore,Karnataka,Edge sense detail pass community.
352,Samantha Thornton,Blockchain,1,CET Trivandrum,Tamil Nadu,Middle song ground ask whom.
353,William Allen,Cybersecurity,4,NIT Trichy,Tamil Nadu,Loss though church seat follow.
354,Austin Francis,Blockchain,4,VIT Vellore,Tamil Nadu,Over now mother to might own.
355,Wesley Garcia,IoT,4,IIT Madras,Karnataka,Key recent trip five I majority.
356,Jennifer Perez,AI & ML,3,CET Trivandrum,Kerala,Foot learn deal half cold film action town.
357,April Smith,Blockchain,2,CET Trivandrum,Karnataka,Name gun my put.
358,Elizabeth Mason,IoT,2,VIT Vellore,Karnataka,Have model sister marriage purpose while glass.
359,Emily Robinson,Cybersecurity,1,NIT Trichy,Kerala,Ask peace certain why exist our game ready.
360,Brenda Lynch,Blockchain,4,CET Trivandrum,Maharashtra,Than past world situation for.
361,Jason Serrano,Blockchain,3,IIT Madras,Karnataka,Voice serious make laugh impact field.
362,Terry Rhodes,Blockchain,3,VIT Vellore,Tamil Nadu,Save range account say my.
363,Tina Bowen,Cybersecurity,2,CET Trivandrum,Kerala,Behind ago window fly defense house.
364,Michele Hamilton,IoT,4,VIT Vellore,Tamil Nadu,Price firm yourself.
365,Theresa Russell,IoT,4,VIT Vellore,Karnataka,Manager wonder food eight scene.
366,Rhonda Phillips,Blockchain,2,IIT Madras,Karnataka,Where pull mention.
367,Gloria Bennett,AI & ML,3,VIT Vellore,Kerala,Agree few back hour year.
368,Tina Jones,AI & ML,1,VIT Vellore,Maharashtra,Let represent play claim age major important.
369,Christina Brown,IoT,4,CET Trivandrum,Kerala,Themselves thousand throughout charge.
370,Jason Harris,Blockchain,1,VIT Vellore,Tamil Nadu,Major which debate wonder.
371,Fernando Luna,IoT,4,CET Trivandrum,Kerala,West source doctor method city those rich.
372,John Osborne,Blockchain,3,NIT Trichy,Karnataka,Event bit clearly room grow join.
373,Joseph Jimenez,Blockchain,2,CET Trivandrum,Maharashtra,Along message into paper.
374,Amy Porter,Cybersecurity,3,NIT Trichy,Karnataka,Understand catch share.
375,Paul Vaughn,AI & ML,3,CET Trivandrum,Tamil Nadu,Tonight realize show trouble treatment body.
376,Heather Lewis,Cybersecurity,3,NIT Trichy,Kerala,Show government according himself on.
377,Veronica Lewis,Cybersecurity,2,CET Trivandrum,Kerala,Above leave several friend agent.
378,Gina Wagner,Blockchain,3,CET Trivandrum,Kerala,Room real family say military seem.
379,Nicole Small,IoT,2,VIT Vellore,Maharashtra,Reality trade hot hear foot family.
380,Lisa Thompson,AI & ML,2,VIT Vellore,Karnataka,Bank trouble high shake rise.
381,Jim Jacobs,IoT,4,NIT Trichy,Maharashtra,Pick hope significant require.
382,Jon Wells,AI & ML,4,IIT Madras,Tamil Nadu,Attorney high art the forward source relate.
383,Misty Cain,Blockchain,4,IIT Madras,Maharashtra,Soldier help service unit notice accept just else.
384,Timothy Gill,Cybersecurity,1,VIT Vellore,Tamil Nadu,When remain difference.
385,Abigail Hodge,Blockchain,3,CET Trivandrum,Kerala,Win rather owner source wait.
386,Jennifer Fox,Blockchain,1,NIT Trichy,Karnataka,Even establish toward.
387,Joseph Jackson,Cybersecurity,3,NIT Trichy,Karnataka,Like safe war page.
388,Kathleen Thompson,AI & ML,1,IIT Madras,Tamil Nadu,Summer happy turn coach traditional money different.
389,Susan Anderson,IoT,1,IIT Madras,Kerala,History stop eat sing.
390,Amy Miller,Cybersecurity,2,CET Trivandrum,Maharashtra,Guess simply collection voice.
391,Katrina Reyes,Cybersecurity,3,CET Trivandrum,Maharashtra,One choice what enter none.
392,Rebecca Brooks,IoT,4,CET Trivandrum,Maharashtra,Difficult expect up him cold.
393,Cristian Ritter,AI & ML,1,IIT Madras,Maharashtra,Reduce line move blue.
394,David Lester,Cybersecurity,1,CET Trivandrum,Maharashtra,Middle cell scientist his.
395,Susan Rivers,Cybersecurity,1,IIT Madras,Karnataka,Under recognize yes east personal partner.
396,Benjamin Vargas,IoT,3,VIT Vellore,Kerala,Short population near knowledge.
397,Shannon Stevens,Blockchain,4,NIT Trichy,Tamil Nadu,Around mean history nor.
398,Hannah Wilson,Blockchain,1,IIT Madras,Tamil Nadu,Each though goal see city wrong present.
399,Kimberly Brown,IoT,3,VIT Vellore,Kerala,Performance live add thus leave fear television.
